Identification,Addressee,Location,Date (d/m/y),Date (if unspecified),Keywords,Relevance,Summary,Quotes
CLI.69,Katharine Tynan,"3 Blenheim Road, Bedford Park","May 19, 1888",,"Reviews, reaction to KT's poems, publications",0,"Comments on reviews to Todhunter book, praises KT's poems, tells her of lecture he is going to give and pieces he has sent to various publications.",
CLI.73,Katharine Tynan,"3 Blenheim Road, Bedford Park","Jun 20, 1888",,,0,Requests copy of ballad book. Talks about attack to John F. Taylor in United Ireland. Compliments KT poetry. Morris' play. Plans for FFT. John Sherman almost finished,
CLI.75,Dr. William Frazer,"3 Blenheim Road, Bedford Park","Jun 23, 1888",,,0,"Sends early version of ""Stolen Child"" for the doctor's appraisal.",
CLI.77,Katharine Tynan,"3 Blenheim Road, Bedford Park","Jul 2, 1888",,,0,"Requests introduction to Lady Wilde for completion of folk lore book. Comments on his and other's reactions to Todhunter's ""Children of Lir"".
Reviews to the ballad book.",
CLI.78,Father Matthew Russell,"3 Blenheim Road, Bedford Park","Jul 5, 1888",,,0,Lists tales to be included in FFT and asks for further guidance and suggestions.,
CLI.80,Douglas Hyde,"3 Blenheim Road, Bedford Park","Jul 11, 1888",,,0,"Asks Hyde for help with FFT, explains its sections.",
CLI.83,Douglas Hyde,"3 Blenheim Road, Bedford Park",,mid-July 1888,,0,Gives more info about FFT nad asks for more stories. Lists all the stories so far.,
CLI.86,John O'Leary,"3 Blenheim Road, Bedford Park","Jul 27, 1888",,,0,Reports being too busy to write because of book and asks for help with material.,
CLI.88,Douglas Hyde,"3 Blenheim Road, Bedford Park","Aug 6, 1888",,,0,"Thanks Hyde for help, praises translated stories hw sent, asks him for notes. More news on FFT.",
CLI.89,Douglas Hyde,"3 Blenheim Road, Bedford Park",,"c. Aug 25, 1888",,0,"Sends batch of proofs, asks for notes to be put at the end of the book and for correct spelling of gaelic words.",
CLI.103,John O'Leary,"3 Blenheim Road, Bedford Park","Oct 8, 1888",,,0,Acknowledges forms and checks sent. Comments on reviews printed and planned. John Sherman almost finished. Blavatsky gossip.,
CLI.105 (a),John O'Leary,"3 Blenheim Road, Bedford Park",,"after October 13, 1888",,0,"Returns illegible forms. Comments on Sligo paper review of FFT. Asks for advice regarding which American papers to send the book to, besides Boston Pilot.",
CLI.105 (b),Douglas Hyde,"3 Blenheim Road, Bedford Park","Nov 9, 1888",,,0,Asks Hyde for help with fairy article (classification of Irish spirits). Praises Hyde's writing and asks if he is to publish book of ballads.,
CLI.106,Katharine Tynan,"3 Blenheim Road, Bedford Park","Nov 14, 1888",,,0,"Sends Oisin proofs, asks for criticism and tells what others said. Rewriting John Sherman based on Ellis' suggestions. Networking. Suggests using tales in FFT as subjects for ballads and comments on interest in Countess Kathleen O'Shea story. Reports reading Tolstoi. Criticizes Merideth's ""Diana"".","""I am reading Tolstoi -- great and joyless. The only joyless man in literature so different from Tourganeef. He seems to describe all things whether beautiful or ugly painful or pleasent with the same impartial indifferent joylessness"".
""He [Merideth] makes the mistake of making the reader think too much. One is continually laying the book down to think. He is so suggestive ones mind wanders. The really great writers of fiction maje their readers/ minds like spunges""."
CLI.108,W. M. Crook,"3 Blenheim Road, Bedford Park",,"c. Nov 15, 1888",,0,Provides Hyde's address. Invites him to tea. Makes arrangements for seeing Blavastsky.,
CLI.109,John O'Leary,"3 Blenheim Road, Bedford Park","Nov 19, 1888",,,0,Asks JO'L for suggetions regarding papers to send FFT to. Todhunter to give lecture and draw largely from FFT. JBY writing stories. Asks for news of Hyde. Comments on John Sherman.,"""I have to get to work at my story -- the motif of which is hatred of London""."
CLI.110,Katharine Tynan,"3 Blenheim Road, Bedford Park","Dec 4, 1888",,,0,"Sends promised and much delayed sketch of KT. Reports writing in a day, practice with Sherman improving his writing skills. Asks advice on newspapers to send FFT. Lily working at Morris' embroidery.","""I would have done it [written the sketch] long ago but thought it would be a work of several days. However my practice over ""Sheran"" has made my prose come much more easily""."
CLI.122,Douglas Hyde,"3 Blenheim Road, Bedford Park","Dec 13, 1888",,,0,"Thanks for folklore letter, asks for help with finding typical clothes for a friend who wants to illustrate Todhunter's story. Asks for help with gaelic words. Asks about Hyde's plans for publications.",
CLI.113,Douglas Hyde,"3 Blenheim Road, Bedford Park","Dec 15, 1888",,,0,News on Nash drawing. Asks about Aroon and the different versions he's heard. Wonders about pooka reference. Asks about a gaelic speaking poet from Tipperary and asks Hyde to translate some passages from gaelic for a possible job for Dic. of Nat. Biography.,
CLI. 122,Katharine Tynan,"3 Blenheim Road, Bedford Park","Jan 13, 1889",,,0,Finds letter to Prof. Joyce he was supposed to have enclosed. Asks if she wants a copy of Oisin for herself (her father was the subscriber). Asks for comments and help in choosing newspapers to send it to. Publications. News of Lily at the Morrises.,
CLI.124,John O'Leary,"3 Blenheim Road, Bedford Park","Jan 16, 1889",,,0,Asks for extra copies of Oisin to be sent to himself or KT. Asks for help with papers to sent the book to.,
CLI.125(a),Katharine Tynan,"3 Blenheim Road, Bedford Park","Jan 16, 1889",,,0,Asks for help sending books to subscribers.,
CLI.127,Katharine Tynan,"3 Blenheim Road, Bedford Park","Jan 24, 1889",,,0,"More on subscribers. Rhys's article and his interest in ""New Celtic"" poets. Reviews to Oisin and FFT",
CLI.129,? E. Scull,"3 Blenheim Road, Bedford Park","Jan 30, 1889",,,0,"Reply to an unidentified correspondent who liked ""Vivien"". WBY thanks him and says he likes the poem because it has ""old associations gathered about it"". Reports the divide that ""Oisin"" (the poem) creates among his friends.",
CLI.132,Father Matthew Russell,"3 Blenheim Road, Bedford Park","Jan 31, 1889",,,0,Reports many reviews to Oisin and thanks Father Russell for his own. Reacts to them. Tells Father Russell about correspondant who sent poems.,"""I do not expect any very immediate popularity for any of my poems. They are too remote from common life"".
""I dare say you will not thank me for sending another writer of verse knock at your gate. But then, you know, you keep a kind of College of the bards""."
CLI.133,Katharine Tynan,"3 Blenheim Road, Bedford Park","Jan 31, 1889",,,0,Reports what newspaper reviews say. Reports meeting MG. More on reviews. XXXX,
